number,name,credit,sylabus
046342,מבוא לתקשורת בסיבים אופטיים,3,"התפשטות גלים בסיבים אופטיים, תכונות לינאריות ולא לינאריות של סיבים, אותות מרובבי אורך גל, WDM, הגברה אופטית ורעש, פרקים מתורת הגילוי של אותות אופטיים."
046733,תורת האינפורמציה,3,אפיון מקורות וערוצים. צפינת מקורות. הגדרת האינפורמציה ההדדית. משפט עבוד הנתונים.  שיטת הסדרות הטיפוסיות. פונקצית קצב-עוות ושמושים למקורות אנלוגיים ודיסקרטיים. קצב האינפורמציה וקבול הערוץ. משפט הצפינה. צפינה משולבת מקור-ערוץ ומשפט ההפרדה.
046745,עבוד ספרתי של אותות,3,"השפעת אורך מלה סופי במסננים ספרתיים. שערוך לא פרמטרי של ספקטורום הספק- פריודוגרמות. עיבוד רב-קצבים: מערכות דצימציה ואינטרפולציה, מימוש פוליפאזה ומערכות מרובות דרגות. מערכי מסננים דו-ערוציים, מערכים במבנה עץ, מערכים אחידים. התמרת פוריה לזמן קצר אנליזה וסינתזה, ייצוג GABOR. מבוא ל-WAVELETS : אנליזת זמן-תדר, אנליזה מרובת רזולוציות. תוצאות למידה: בסיום הקורס הסטודנט ידע: 1. קוונטיזציה ומודל לרעש קוונטזיציה. 2. שגיאות חשיוב (נקודה קבועה ונקודה צפה) במסננים ספרתיים. 3. מניעת גלישה והבטחת יציבות במסננים ספרתיים. 4. שיערוך לא פרמטרי של ספקטרום הספק - פריודוגרמות. 5. מערכות דצימציה ואינטרפולציה, מימוש פוליפאזה, מימוש מרובה דרגות. 6. מערכי מסננים דו ערוציים - BILINEAR, CQF, QMF, מערכני מסננים במבנה עץ. 7. מערכי מסננים אחידים. 8. התמרת פוריה לזמן קצר, אנליזה וסינתיזה התמרת GABOR. 9. אנליזת WAVELET , אנליזה מרובת רזולוציות."
046773,"התקני מל""מ אלקטרואופטיים לגלוי",3,"מקורות קרינה:  קרינת גוף שחור, קרינה ספונטנית ומאולצת.  גלאים אלקטרו-אופטיים:  בליעת קרינה, גלאים לקרינה, מדד לביצועי גלאי קרינה (יחס אות-רעש), גלאי פוטומוליך, גלאי פוטו-וולטאי, פוטו-דיודה דיודה PIN, תאי שמש, פוטוטרנזיסטור, תגובתיות ( RESPONSIVITY ), סף קליטה ( DETECTIVITY ) והתגובה בזמן של גלאי.  דוגמאות של גלאים לתחום הנראה ותחום האינפרה-אדום: SI, INSB וכן HGCDTE, מערכי דיודות צמת ו-CCD. גלאים תרמיים:  צמד תרמי, מערכי צמדים ( THERMOPILE ), גלאים פירו-אלקטריים.  מעגלי עיבוד אות למערכי גלאים.%"
046853,ארכיטקטורות מתקדמות,3,"נושאים: ארכיטקטורות מחשבים בעלי יכולת חישוב גבוהה בסביבה מרובת מעבדים. שיטות איכותיות וכמותיות בסביבה מוגבלת הספק ושטח סיליקון. הגדרת מגמות הסביבה הטכנולוגית וטכניקות הקיימות והעתידיות במבנה המחשב והמערכת, כגון: מיפוי חוטים המבוסס על מהותם, ערך המטמון במכונות מרובות מעבדים לעומת מכונות מרובות חוטים, זיכרונות מטמון בסביבה מרובת מעבדים, בקרה, שימוש וחלוקת משימות ומשאבים המבוססת על אינפורמציה דינמית (משתנה בזמן), שינויים במבנה הדינמי של המערך החישובי ומורכבות הטיפול בו. שיטת זיכרונות מטמון מתקדמות למערכות מרובות מעבדים, מערכות חישוב אסימטריות, מערכות הפועלות על בסיס אנליזת תכולת מידע."
046880,תכן לוגי של מער. וי.אל.אס.אי,3,"ייצוגים של מערכות VLSI. מתודולוגיות של תכן. כלי תכן לסוגיהם. מודלים מבניים והתנהגותיים. שפות ומבני נתונים לתיאור חמרה. אימות סטטי ודינמי. סימולטורים לרמות ייצוג שונות. שיטות לאימות פורמלי, שימוש ב-BDD. סינתזה לוגית אוטומטית. ניתוח סטטי של השהיות ומסלולים. סינתזה להשגת יעדי תזמון. תוצאות למידה: בתום הקורס הסטודנט ידע 1. לתאר את תהליך הסינתזה של מערכת VLSI ואת האלגוריתמים בהם משתמשים במגוון סוגים של כלים לתכן אוטומטי בעזרת מחשב. 2. להשתמש בייצוגי מערכת, אלגוריתמים ומבני נתונים במטלות תכנות. 3. ירכוש תובנות ויפתח יכולת להבין ספרות מקצועית בתחום."
046903,מעגלים משולבים בתדר רדיו,3,רכיבים פאסיביים. התקני MOS בתדר רדיו. קווי תמסורת. דיאגרמת סמיט. פרמטרי 'S'. תכן של רשתות הגבר הספק. יציבות. תכן של מגברי CMOS בתדר רדיו. מגבר רחב סרט ומגבר מכוון. מקורות רעש. מגבר רעש נמוך. עיוות. עקרונות המקסר. מיקסרים פאסיביים ואקטיביים.
054133,מבט על הנדסה כימית וביוכימית,1,הכרות קצרה עם הטכניון והפקולטה להנדסה כימית. הגדרת המקצועות הנדסה כימית והנדסה ביוכימית. מקומו של המהנדס הכימי והביוכימי בתעשייה. תחומי מחקר בהנדסה כימית. הקורס מיועד במסגרת הבחירה החופשית לסטודנטים בסמסטר ראשון בפקולטה להנדסה כימית והמסלול להנדסה ביוכימית.
054135,מבוא להנדסה כימית וביוכימית,3.5,"מטרת הקורס לאפשר הכרה ראשונית של ההנדסה הכימית והביוכימית ולהקנות כלים בסיסיים לעוסקים במקצוע זה. הנושאים הנלמדים: יחידות, דייקנות ודיוק, מספרים חסרי ממדיים, גזים אידיאלים וראליים. שיווי משקל אדים ונוזל, חוק הפאזות, טבלאות קיטור. מאזני חומר: מאזנים במצב יציב, מאזנים ללא ועם תגובות כימיות, תהליכי סחרור ומעקף. מאזני אנרגיה: מאזן אנרגיה כללי, חום ועבודה, מאזני אנרגיה במצב יציב, מאזני אנרגיה עם תגובות כימיות. מאזני חומר ואנרגיה סימולטניים. מאזני חומר ואנרגיה במצב לא יציב."
054136,תהליכי הפרדה 1 בה.כימית וביוכימית,3.5,"המקצוע עוסק בתהליכי הפרדת נוזל-מוצק, נוזל-אדים, ומוצק-גז וכן במערכות חלקיקים. רתיחה ועיבוי. זרימת פלואידים דרך מצע נקבובי. סינון מוצק-נוזל. מפל לחץ בזרימת גז-נוזל בעמוד מוארז. הרחפה. זרימה על פני גופים טבולים: מקדמי גרר. תנועת חלקיקים בפלואידים. שקיעת חלקיקים בשדה כובד ובשדה צנטריפוגלי. הפרדת חלקיקים לפי גודל וצפיפות: מסמיך, ציקלון. אפיון גודל חלקיקים. ניפוי, טחינה וגריסה. ערבוב נוזלים ומוצקים. אידוי, חישוב מאיידים חד-ורב-דרגיים. מבוא לגיבוש. מאפייני סינון של חומרים ביולוגיים, שבירת תאים, מבוא לתהליכי ממברנות."
054251,עבודה בתעשיה  1,1,"עבודה במפעל תעשייתי בתפקיד התורם להקנית נסיון מקצועי בהנדסה כימית. משך העבודה - 6 שבועות לפחות. לאחר סיומה על הסטודנט להגיש דו""ח על פעילותו במפעל.% הערה: המקצוע מוצע לסטודנטים שצברו לפחות 80 נק' זכות."
054306,עקרונות הנדסה כימית 2 מ',4,"המקצוע עוסק בתופעות מעבר חום ויישומן ההנדסי במתקני מעבר חום וכן בעקרונות תופעות מעבר חומר. מנגנוני מעבר חום. מעבר חום בהולכה במצב תמידי ואי תמידי. מעבר חום בהסעה. אנליזת מימדים: מקדמי מעבר חום בהסעה טבעית ומאולצת. מתאמים למקדמי מעבר חום בהסעה. אנלוגיות למעבר תנע וחום. מחליפי חום. מעבר חום בקרינה. מאזן אנרגיה דיפרנציאלי כללי. שכבת הגבול התרמית. מנגנוני מעבר חומר. מאזני חומר דיפרנציאליים. מעבר חומר בדיפוזיה מולקולרית במצב תמידי ואי-תמידי. מעבר חומר בהסעה. אנלוגיות למעבר תנע, חום וחומר. שכבת גבול ריכוזית."
054314,מבוא לדינמיקה ובקרת תהליכים מ',3,"פתוח מודל תהליכי דינמי. ליניאריזציה. ניתוח מערכות דינמיות ליניאריות בתחומי הזמן ולפלס. תגובתן בזמן של מערכות ליניאריות. יציבות. תכן וכוונון של מערכות בקרה במשוב. ניתוח ותכן של מערכות בקרה באמצעות שיטת מקום השורשים. הכרה ושימוש בתוכנות מחשב לפתרון של מודלים מתמטיים, ניתוחם והצגתם באופן גרפי."
054315,תרמודינמיקה ב',3,"שיווי משקל בין פאזות במערכות רב-מרכיביות. חישוב הרכבים בתמיסות אידיאליות ובלתי אידיאליות, מקדמי פעילות, תמיסות אלקטרוליטים, שיווי משקל כימי, חישוב הרכבים בשיווי משקל."
054317,תרמודינמיקה ב' מתקדם,3.5,"שיווי משקל בין פאזות במערכות רב-מרכיביות. חישוב הרכבים בתמיסות אידיאליות ובלתי אידיאליות, מקדמי פעילות, תמיסות אלקטרוליטים, שיווי משקל כימי, חישוב הרכבים בשיווי משקל. ביצוע ניסוי מעבדה לקביעת תכונות אנתלפיה, אנטרופיה ואנרגית גיבס, מתח פנים של מוצק, סיווג תמיסות לפי תכונות העודף וקביעת יציבות וחיזוי הפרדות לשתי פאזות."
054350,פולימרים 1,2.5,"הקדמה והגדרות. מנגנוני פולימריזציה. קינטיקה של פילמור שרשרת. קינטיקה של קופולימריזציה. קינטיקה של פילמור בשלבים. תהליכי פולימריזציה תעשייתיים במסה, תרחיף, תחליב ותמיסה. המבנה הכימי של פולימרים שימושיים."
054351,פולימרים 2,2.5,תרמודינמיקה של תמיסות פולימריות. שיטות לקביעת משקל מולקולרי. ריאולוגיה של תמיסות פולימריות ופולימרים מותכים. תכונות פיסיקליות ומכניות של פולימרים במצב מוצק. מבנים אמורפיים וגבישיים. אלסטיות גומי. עיבוד חומרים תרמופלסטיים.
054364,עבודה בתעשיה 2,1,"עבודה במפעל לפי המתכונת המצוינת במקצוע ""עבודה בתעשיה 1""% המקצוע מוצע לסטודנטים שצברו לפחות 120 נק' זכות."
054367,פרויקט מחקר 1,2.5,"הסטודנט יבצע מחקר נסויי או עיוני באחד משטחי ההנדסה הכימית בהנחית חבר סגל בכיר. על הסטודנט להגיש דו""ח על העבודה. הערה: המקצוע פתוח לסטודנטים מצטיינים בלבד."
054368,פרויקט מחקר 2,2.5,"הסטודנט יבצע מחקר נסויי או עיוני באחד משטחי ההנדסה הכימית בהנחית חבר סגל בכיר. על הסטודנט להגיש דו""ח על העבודה. הפרויקט יכול להיות המשך ל""פרויקט מחקר 1"", או להיות מחקר עצמאי שונה.% הערה: המקצוע פתוח לסטודנטים מצטיינים בלבד."
054376,הנדסה אקולוגית בחיי היומיום,2,"שימוש בידע הנדסי בחיי היומיום עם דגש על התקנים אקולוגיים המשמשים בסביבת הבית. בקורס מוצגים התקנים אקולוגיים המשמשים בחיי יומיום והעקרונות ההנדסיים המשמשים לבנייתם ולהפעלתם. בין ההתקנים המוצגים: מצננים מדבריים, תנורי שמש, קירור גיאותרמי, פאנלים פוטוולטאיים, בנייה בחומרים טבעיים."
054377,מבוא לטכנולוגית אבקות,2,"חלק גדול מהמוצרים הכימיים מיוצרים, משונעים ונמכרים כאבקות. מומחיות בטכנולוגיית אבקות הכרחית לייצור אבקות בעלות תכונות רצויות, טיפול בהן ושימושן בהמשך התהליך. הקורס יעסוק בהיבטים השונים של ייצור ושימוש באבקות בתעשייה, בדגש על תעשיית התרופות: גיבוש, הפרדה מאויר או נוזל, הקטנת גודל חלקיקים, שיטות עיבוד ושיטות אפיון."
054400,מעבדה   להנדסה כימית 2,2.5,"במעבדה זו מבוצעים ניסויים שנועדו להמחשת : א. עקרונות פעולות יסוד המבוססות על תהליכי מעבר חומר. ב. עקרונות הנדסת ריאקטורים כימיים. מטרת המעבדה ומתכונתה זהים לאלו של המקצוע ""מעבדה להנדסה כימית 1""."
054406,מחקר גמר 1,3,"הקורס מיועד לסטודנטים בפקולטה להנדסה כימית (כל המסלולים) בסמסטר השביעי ללימודיהם. הסטודנטים יבצעו מחקר ניסויי או עיוני באחד משטחי ההנדסה הכימית או הביוכימית, בזוגות או יחידים. בהנחיית חבר סגל בכיר. על הסטודנט למצוא מנחה ונושא מחקר לפני תחילת הסמסטר. הנושא ייחקר בדרך כלל במשך שני סמסטרים (ראה מחקר גמר 2). היקף המחקר הוא 8 שעות שבועיות. בנוסף יתקיימו מספר פגישות במהלך הסמסטר אשר הנוכחות בהן היא חובה. במשך הסמסטר על הסטודנטים להגיש שני דוחות ביניים. בסוף הסמסטר על הסטודנטים להציג את עבודתם באירוע כלל פקולטי,ולהגיש דוח מסכם."
054407,מחקר גמר 2,3,"הסטודנט ישלים בדרך כלל את המחקר שהתחיל במסגרת המקצוע ""מחקר גמר 1 "", ובתום הסמסטר ידווח על עבודתו וממצאיה בכתב ובתצוגת פוסטרים."
054408,מב.לתכן ריאקטורים כימיים וביוכימ.,3.5,"תורת ההתנגשויות, משטחי פוטנציאל, קואורדינטת ריאקציה ותורת הקומפלקס המופעל. שטף ריאקציה, סדר ריאקציה, ריאקציות מסדר ראשון ושני, ריאקציות מורכבות, ריאקציות שרשרת. השפעת הטמפרטורה. קטליזה הומוגנית. ספיחה וקטליזה הטרוגנית. קינטיקה אנזימטית. גידול תאים. אפיון תכונותיהם של ריאקטורים אידאלים: המנתי, הבוכנתי, והבחוש. ניתוח השפעות גודל ריאקטור וחלוקת תוצרי תגובות במערכות איזותרמיות."
054412,הנדסה ביוכימית,3.5,"קינטיקה של ריאקציות אנזימטיות, עיכוב וקואופרטיביות, אנזימים אלוסטריים, אנזימים מקובעים. מבוא לבקרה מטבולית. מקדמי בקרה ואלסטיות, ניתוח של רשתות מטבוליות, ויסות היצע וביקוש ועיכוב במשוב שלילי. מבוא לביולוגיה מערכתית, מודלים מבוססי אילוצים, מאזני שטף ברשתות מטבוליות. מעגלי בקרה גנטית כמערכות דינמיות. היבטים מערכתיים של מטבוליזם ובקרה גנטית. ריאקטורים ביולוגיים, מעבר חום וחומר בביו-ריאקטורים. יציבות גנטית ותחרות באוכלוסיות תאים מעורבות."
054416,תכון אינטגרטיבי של תהליכים כימיים,4,"קורס זה מלמד את הסטודנט לבצע תכנון אינטגרטיבי של תהליכים כימיים על מנת לקיים דרישות השוק תוך הגברת רווחים, הבטחת איכות המוצר, מזעור הנזק הסביבתי, והפעלה בטוחה ומבוקרת של מתקן היצור. קורס זה מנוהל במתכונת ""הכיתה ההפוכה""."
054419,מב.לתכן ריאקטורים כימים וביוכימים,4,"חלק 1: קינטיקה של ריאקציות אלמנטריות, שווי משקל כימי, קינטיקה של ריאקציות רב-שלביות (ריאקציות מורכבות, ריאקציות שרשרת, ריאקציות פיצוץ, ריאקציות פילמור). ספיחה ונתיקה, קטליזה, קינטיקה של קטליזה הומוגנית, הטרוגנית ואנזימטית. חלק 2: התורה הקינטית של הגזים, תורת ההתנגשויות, מקדמי מעבר, תורת קומפלקס המעבר, משטחי פוטנציאל. חלק 3: הכרה, אפיון ותכנון של ריאקטורים אידאלים הפועלים איזותרמית הן במצב מתמיד והן במצב בלתי מתמיד (ריאקטורים מנתיים, ריאקטורים צינוריים, ריאקטורים בחושים, ריאקטורים מנתיים למחצה).התאמה בין נפח נדרש וסוג מועדף ובין מאפייני הריאקציה. חיבור_בין ריאקטורים, שיקולי נצילות וסלקטיביות."
054420,מעבדה להנדסה כימית 2 בכ',1.5,במעבדה זו מבוצעים ניסויים שנועדו להמחשת: א. עקרונות פעולות יסוד המבוססות על תהליכי מעבר חומר. ב. עקרונות הנדסת ריאקטורים כימיים.
054452,בעיות סביבתיות-זיהום אויר,2.5,"הכרת בעיות זיהום האויר בסביבה והדרכים לפתרון בעיות אלה. הצגת ופתוח המושגים היסודיים של זיהום אויר: סוגי המזהמים, תכונותיהם. רוחות מקומיות ורוחות גלובליות. מצבים אטמוספיריים והשפעתם על הפיזור של מזהמים באטמוספרה. הווצרות מזהמים בתהליכי שריפה. סילוק מזהמים מתהליכים שונים."
056120,מיקרוסקופית אלקטרונים של חומר רך,2,"הקורס עוסק באפיון חומרים רכים על ידי מיקרוסקופית אלקטרונים סורקת ומיקרוסקופית אלקטרונים חודרת וכולל:  הכרת הרכיבים השונים במיקרוסקופ אלקטרונים סורק ומיקרוסקופ אלקטרונים חודר, עקרונות יצירת תמונה במיקרוסקופיית אלקטרונים, האינטראקציה בין קרן האלקטרונים לדגם, שיטות להכנת דגמים למיקרוסקופית אלקטרונים של חומרים רכים עם דגש על מיקרוסקופית אלקטרונים בטמפרטורות קריוגניות, אפיון תלת-ממדי באמצעות טומוגרפיית אלקטרונים, אפיון הרכב כימי במיקרוסקופית אלקטרונים, יישומים. תוצאות למידה: בסיום הקורס הסטודנט יהיה מסוגל:% 1. לתאר את המרכיבים העיקריים של מיקרוסקופ אלקטרונים חודר ומיקרוסקופ אלקטרונים סורק, ולהבין כיצד הם תורמים ליצירת תמונה בשיטות הדימות השונות וע""י הגלאים השונים במיקרוסקופים. 2. להבין את העקרונות שקובעים את הניגודיות ואת הרזולוציה במיקרוסקופית אלקטרונים. 3. להכיר מגוון שיטות הכנת דגמים למיקרוסקופית אלקטרונים של חומרים רכים עם דגש על מיקרוסקופית אלקטרונים בטמפרטורות קריוגניות, כולל מגבלות, ארטיפקטים ונזק הנגרם מקרן האלקטרונים.% 4. להבין את העקרונות המשמשים לאפיון תלת-ממדי במיקרוסקופ אלקטרונים חוזר."
056178,שיטות מקורבות בהנדסה,2,"שיטות אסימפטוטיות: הפרעות רגילות. שיטות הפרעה סינגולרית: STRAINED PARAMETERS, פיתוחים פנימיים, חיצוניים ומרוכבים. סקלות מרובות. שיטות נומריות: טכניקות לפתרון מערכות של משוואות אלגבריות. אנליזה של משוואות דיפרנציאליות חלקיות לינאריות ולא-לינאריות, אליפטיות ופרבוליות בשיטת האלמנטים הסופיים. יישומים בהנדסה כימית. שיטות ספקטרליות ויישומן בבעיות הנדסה כימית. תוצאות למידה: בסיום הקורס הסטודנטים ידעו:% 1. לפתור מערכת משוואות אלגבריות לינאריות בשיטות ישירות ואיטרטיביות. 2. לפתור מערכת משוואות אלגבריות לא לינאריות בשיטת ניוטון רפסון. 3. לבצע אינטגרציה נומרית בשיטת גאוס לג'נדר. 4. לגשת לפתרון של משוואות דיפרנציאליות חלקות אליפטיות ופרבוליות, לינאריות ולא לינאריות בשיטת האלמנטים הסופיים של גלרקין. 5. לבנות פיתוחים אסימפטוטיים רגולריים עבור פתרונות של משוואות אלגבריות ודיפרנציאליות. %6. לדעת מתי פיתוח אסימפטוטי רגולרי/אחיד כושל, לזהות מקור של סינגולריות בפיתוח . %7. לפתור משוואות דיפרנציאליות לא לינאריות בשיטת ""קורדינטות מתוחות"". % 8. לפתור משוואות דיפרנציאיות לא לינאריות בשיטת ""סקלות מרובות""."
056394,תבניות ריח# מבוא ויישומים,2,"כימיה של מולקולות ריח, מנגנוני היווצרות של מולקולות ריח-חומרים אורגניים נדיפים ונדיפים למחצה, תהליכים מטבוליים ושימושים קליניים-דיגום נשיפה, טכנולוגיות ושיטות זיהוי-מערכות אנליטיות וחיישנים, שימושים טכנולוגיים בתחומים נוספים- איכות סביבה, מזון, זיהוי פלילי.% תוצאות למידה: בסיום המקצוע הסטודנט יהיה מסוגל: 1. לתאר ולפרש תהליכים ומולקולות כימיות הקשורות לריח. 2. להבין תהליכים תרמודינמיים ומנגנוני היווצרות של מולקולות נדיפות. 3. לנבא תהליכים היכולים להביא ליצירת מולקולות או סמנים נדיפים בקליניקה,בתעשיה ובסביבה. 4. להשוות ולהדגים מנגנוני חישה של ריח ושימושם באורגניזמים בטבע ובמיוחד בבני אדם. 5. להעריך ולנבא מסלולים מטבוליים לשימוש כסמנים קליניים במחלות. 6. להכיר ולהבין את המתודולוגיה של אנליזת נשימה ושימושיה. 7. לבחור טכנולוגיות אנליטיות או טכנולוגיות חישה לבדיקת חומרי ריח. 8. להבין ולנתח תוצאות סטטיסטיות של ספרות בתחום  9. לסכם ולנתח תוצאות מדעיות וכן להציג עבודה מדעית בפני קהל."
