number,name,credit,sylabus
014003,סטטיסטיקה,3,"יסודות תורת ההסתברות: מרחב מדגם ומאורעות, חישוב הסתברויות במרחב סימטרי, הסתברות מותנית ואי-תלות- נוסחת ההסתברות השלימה ונוסחת בייס, אי-תלות של מאורעות. משתנה מקרי בדיד ורציף: משתנים מקריים והתפלגותיהם, תוחלת ושונות של משתנה מקרי, התפלגויות מיוחדות. משתנה מקרי דו-מימדי. משפט הגבול המרכזי. הסקה סטטיסטית: סטטיסטיקה תאורית. אמידה נקודתית. אמידה מרווחית: רווחי סמך. רווח סמך לתוחלת (כאשר השונות ידועה ואינה ידועה), רווח סמך לשונות. בדיקת השערות: רמת מובהקות ועוצמה המבחן. הסקה על תוחלת, שונות ופרופורציה. השוואת שתי אוכלוסיות: מבחן T לשני מדגמים בלתי תלויים ומדגמים מזווגים, השוואת שתי פרופורציות. מבחן חי-בריבוע לטיב התאמה. ניתוח שונות, רגרסיה."
014004,נתוח מערכות,3,"בעיות אופטימזציה בהנדסה אזרחית וסביבתית וניסוחן. משפט TKK. תכנות לינארי. דואליות. מבחני רגישות, תכנות דינמי, תורת ההחלטות. יסודות תכנות לא לינארי.מבוא לתכנות בשלמים."
014005,מעבדה הנדסית,1.5,"מעבדה פקולטית בסיסית למכניקת מוצקים: תכונות חומרים, מדידי עבור, מאמצים משולבים, בעיות בכפיפה, פוטואלסטיות, קריסה."
014006,מבוא לשיטות נומריות,3,"פתרון מערכות משוואות לינאריות. פתרון משוואות לא לינאריות. אינטרפולציה, אינטגרציה נומרית. גזירה נומרית. פתרון משוואות דיפרנציאליות רגילות, בעיות ערכים התחלתיים ותנאי שפה. התכנסות ויציבות."
014008,מידע גרפי הנדסי,3,"הקניית הבנה ויכולת בייצוג ותקשורת מידע הנדסי בענף הבנייה באמצעים גרפיים: חיזוק הראייה המרחבית (קריאה של היטלים/חתכים/ פרטים), תקשורת מושגים באמצעות סקיצות, מידול מידע בנין ( BIM ), כולל מידול D3, שימוש בכלי תכנה מתאימים."
014101,פרויקט בקונסטרוקציות,2.5,"הערה:קביעת הציון עפ""י מעקב במשך הסמסטר, בדיקת הפרויקט המוגש והצגתו בפני ועדת שיפוט. ***דרישות קדם: השלמת מקצועות חובה בהנדסת מבנים: 014105 או 014145, 014146 או 014106, 014109 או 014143 + 2 מקצועות בחירה בהנדסת מבנים. תכנון כללי של פרוייקט בשטח הנדסת מבנים על בסיס לימוד עצמי של בעיה הנדסית. השוואת פתרונות שונים. אנליזת המבנה והכנת  תכניות כלליות לאחד הפתרונות כולל פרוט חלקי של רכיבים מבניים. דיווח טכני והצגת הפרויקט בסוף סמסטר הלימוד."
014103,מבוא למכניקה הנדסית,4,"***דרישות קדם: השלמות פיסיקה 1.***% וקטור כח, וקטור מומנט, מערכות שקולות במישור ובמרחב, מערכת שקולה פשוטה ביותר.% מושג הגוף החופשי,שווי משקל, מושגי היציבות והסיום הסטטי.% מסבכים מישוריים ומרחביים, קורות ומסגרות מישוריות ומרחביות.% מהלכי כוחות ומומנטים פנימיים במבנים.% עומסים מפורשים, תכונות גופים ושטחים (מרכז כובד, מרכזית, מומנט ראשון ושני של השטח).% קשרים דיפרנציאליים לכוחות פנימיים במבנים. % כבלים."
014104,תורת החוזק 1,4,"מבוא. מאמץ ועיבור במשיכה ולחיצה. פיתול חתכים שונים, כפיפת קורות אלסטיות והומוגניות. גזירה בשעת כפיפה, מרכז הגזירה. טרנספורמצית המאמץ והעיבור, שקיעות בעזרת המשוואה הדיפרצניאלית של הקו האלסטי, פתרון מבנים בלתי מסוימים. מושגים ראשונים של קריסה אלסטית."
014107,מבוא לתורת האלסטיות,2.5,"וקטורים וטנסורים. דפורמצייה, עיוותים. מאמצים, משואות שיווי משקל. חוקים קונסטיטוטיבים של אלסטיות. בעית ערך-שפה באלסטיות. תורת הפלטות. קריטריונים של חוזק וכשל."
014108,סטטיקת מבנים,3,מהלכי כוחות פנימיים וקווי השפעה במבנים מסוימים סטטית. משפט בטי וחישוב הזזות אלסטיות. שיטת הגמישות. שיטת הקשיחות. קווי השפעה במבנים בלתי-מסוימים סטטית.
014113,יסודות,2.5,"הערה: חלק מציון המעקב הינו הגשת פרוייקט. סיווג מבנים קרקעות ויסודות. שיטת מודול המצע בחישוב יסודות. יסודות אקסצנטריים, יסודות משותפים קשיחים. תכן צורני וקונסטרוקטיבי של יסודות בודדים. תכן מערכת יסודות: קריטריוני כשל של מערכת יסודות בודדים. שקיעות דיפרנציאליות בסיסיות, טבעיות ומרוסנות. ריסון שקיעות ורדיסטרבוציה של מומנטים. אינטראקציה בין מבנה וקרקע והשפעת יחסי קשיחות. יסודות גמישים, קורה על מצע אלסטי. יסוד דוברה. חישוב כלונסאות לכוחות אופקיים."
014131,פרויקט מורחב במבנים-חלק א',2.5,"מיועד לסטודנטים במסלול מבנים בלבד. דרישות קדם: כל המקצועות החובה של מסלול הנדסת מבנים. הערה: קביעת הציון עפ""י מעקב במשך הסמסטר. ציון סופי ייקבע בגמר חלק ב' של הפרויקט. אין אפשרות לקבל ניקוד על מקצוע זה ללא השלמת חלק ב'. חלק א' (014131): תכן כללי של פרויקט מורכב בתחום הנדסת מבנים. לימוד עצמי מתוך ספרות מקצועית של נושאים שונים הקשורים לפרויקט. גיבוש חלופות תכן אפשריות שונות והשוואתן, כולל בחירת חלופת התכן המתאימה ביותר. ראה 014132. הערה: במתכונת חד-סמסטריאלית של מקצועות פרויקט מורחב - חלק א+ב היקף הלימוד השבועי הינו כפול מהרשום למעלה."
014132,פרויקט מורחב במבנים-חלק ב',2.5,"מיועד לסטודנטים במסלול מבנים בלבד. הערה: קביעת הציון עפ""י מעקב במשך הסמסטר, בדיקת הפרויקט המוגש והצגתו בפני ועדת שיפוט. אין אפשרות להתחיל בחלק ב' של הפרויקט לפני סיום חלק א' וקבלת ציון עובר על חלק א' של הפרויקט בסוף סמסטר הלימוד. דרישות קדם: כל המקצועות של מסלול הנדסת מבנים. פרויקט מורחב - חלק א'. חלק א' (014131): תכן כללי של פרויקט מורכב בתחום הנדסת מבנים. לימוד עצמי מתוך ספרות מקצועית של נושאים שונים הקשורים לפרויקט. גיבוש חלופות תכן אפשריות שונות והשוואתן, כולל בחירת חלופת התכן המתאימה ביותר. חלק ב' (014132): תכן סופי של חלופת התכן הנבחרת. אנליזה מפורטת של המבנה על חלקיו השונים. תכן מפורט והכנת תכניות כלליות ותכניות פרטניות של הפרויקט, משורטטת באמצעות מחשב. הכנת דו""ח מסכם של הפרויקט והצגתו בפני ועדת שיפוט בסוף סמסטר הלימוד. הערה: במסגרת הצגת הפרויקט יש להציג את שני חלקיו גם יחד. לא ניתן לקבל ציון על הפרויקט ללא הצגתו בסוף סמסטר הלימוד. הערה: במתכונת חד-סמסטריאלית של מקצועות פרויקט מורחב - חלק א+ב היקף הלימוד השבועי הינו כפול מהרשום למעלה."
014143,שיטות מחשב בסטטיקת מבנים,3,"ניסוח של שיטות הגמישות והקשיחות לפתרון מחשב. מטריצ גמישות וקשיחות של מוט פריזמטי. הרכבה שיטתית של מטריצת קשיחות של מבנה. תכנית מחשב לפתרון קורות נמשכות, מסבכים ומסגרות. מטריצת גמישות וקשיחות של מוט לא פריזמטי. מבוא לשיטת אלמנטים סופיים."
014145,תורת החוזק 2,5,"קריסה, קריסת עמודים, קריסת מסגרות, סימטריה בקריסת מסגרות, פתרון קריסה במחשב. קורות לחוצות צירית (קורת עמוד). אנרגיה במבנים, אנרגיה אלסטית, העמסה קוזיסטטית. שימור אנרגיה, מינימום אנרגיה, משפט קסטליאנו, שיטת ריץ. כפיפה משופעת, טרנספורמצית מומנטי אינרציה.  קורות לא הומוגניות. קריטריוני כניעה, התנהגות פלסטית של חתכים, אנליזה פלסטית של קורות ומסגרות, גרעין החתך."
014147,בניית המהנדס 1,4,"מושגי יסוד בתכן מערכות מבניות למערכות תבניות פשוטות ומורכבות. תכונות אופיניות של חומרי בניין ושילובם במערכת המבנית, תכן תפיסתי וניתוח המערכות המבניות מנקודות מבט יציבות, פונקציונליות, עלות, אופן הביצוע, סימטריה ונאמנות לסכמה המבנית. ניתוח מקרי כשל מבנים ואחריות הנדסית. פיתוח חשיבה ויזואלית, שפת התרשימים והיכולת להציע, לתאר, להשוות ולשפוט באופן בקורתי מערכות מבניות ליישומים שונים, כגון: אולמות בעלי מפתחים גדולים, בניינים רבי קומות, ברכות ומגדלי מים, מבנים מתועשים, מבנים תלויים וכו'. קביעת הציון עפ""י מעקב במשך הסמסטר, פרוייקטים שבועיים, פרוייקט ניסויי סמסטריאלי ובחינה סופית."
014149,מבני בטון 2,4.5,"תכן אלמנטים לחוצים (תמירות), חישוב חתכים לכפיפה דו-צירית עם ובלי כח צירי, פיתול, חדירה, טבלות מצולבות: המשוואה הדיפרנציאלית של טבלות מצולבות, פתרונות המשוואה למקרים מיוחדים, עומס סכין. מומנט סכומי, טבלות מצולבות נמשכות (חישוב ותכן), חישוב פלסטי של טבלות מצולבות, טבלות שטוחות ללא קורות, תקרת צלעות, תקרת ערוגות."
014153,מבני בטון 1,4,"הערה: קביעת הציון עפ""י ציון פרויקט ובחינה סופית. סקירה תמציתית  של תכונות הבטון והפלדה והשתקפותן בתכן מבנים מבטון מזוין. שיטת המצבים הגבוליים בתכן ובחישוב רכיבים מבטון מזוין. מצב גבולי של שירות. חישוב חתכים לכפיפה במצב גבולי של הרס ללא/עם כוח צירי. תקרות מקשיות מתוחות בכוון אחד. תכן רכיבי מבנה קויים - קו כח המתיחה, עיגון. תכן לגזירה ברכיבים מבטון מזוין. רדיסטריבוציה של מומנטים. מבוא לחישוב ישיר של שקיעות: מומנט הסדיקה, סקירת השיטות (מומנט אינרציה שקיל, עקמומיות שקילה)."
014201,פרויקט בהנדסת מים 1,2.5,"תכנון פרויקט יישומי בהנדסת מים בהפעלת חשיבה הנדסית-תכנונית, כלכלית וניצול הידע בהידרוליקה. השלבים העיקריים במהלך הלימודים: בחירת הנושא. איסוף נתונים, עיבודם ניתוחם והצגתם. עיבוד וגיבוש חלופות תכנוניות עפ""י פרמטרים הנדסיים, אופרטיביים, כלכליים ואחרים, ניתוחן והשוואתן. כתיבת דו""ח על הבעיות במצב הקיים, ממצאי העבודה שנעשתה, הצגת היתרונות והחסרונות של הפתרון המוצע והמלצות להמשך הפעילות בעתיד. הפרויקט יוגש בצורת תזכיר מפורט, בהיר ומסודר."
014205,הידרוליקה,3,"עקרונות זרימת נוזלים בלתי דחיסים במובילים סגורים וםתוחים. אנליזה ממדית ודמיות. שכבות גבול בזרימה טורבולנית. זרימה בצינורות: מפל לחץ והפסדים, מעברים, זרימה במערכת צינורות ומשאבות. זרימה בתעלות: זרימה קצובה, עקרונות תכן, אנרגיה סגולית ושימור תנע, עומק קריטי, מעברים, חתכי בקרה, זנק הידרולי, זרימה מודרגת וצירים הידרוליים."
014211,מכניקת זורמים,3,"הידרוסטטיקה, חוקי השימור של מערכות ונפחי בקרה, שיטות נתוח זרימה, מבוא לזרימה פוטנציאלית, מאמצים בזורמים, זרימה צמיגה."
014212,מבוא להידרולוגיה הנדסית,2.5,"המחזור ההידרולוגי, משוואות מאזן, תחום ההתנקזות, שימושי סטטיסטיקה בהידרולוגיה, גשמים, ניתוח נתוני גשם, גשם תכן, חידור וחילחול. זרימות באפיקים, הידרוגרמות, הידרוגרמת יחידה, הילוך גיאות, מי תהום, אקוויפרים ומיונם, חוק דארסי, קרוב דפאווי, זרימה תמידית לבארות."
014214,יסודות מכניקת הזורמים,4,"הגדרה ותכונות של זורמים, הידרוסטטיקה, משפט ההובלה וקינמטיקה, ניסוח אינטגרלי של חוקי היסוד (שימור מסה, אנרגיה ותנע), ניסוח דיפרנציאלי של חוקי היסוד (מש' הרציפות ומש' נוויה סטוקס),  תנאי שפה ופתרונות מדויקים, זרימה פוטנציאלית, זרימה טורבולנטית ושכבות גבול."
014300,סמינריון בהנ. סביבתית ומשאבי מים,1.5,"הערה: מיועד בעיקר לסטודנטים שסיימו לפחות 6 סמסטרים. לימוד נושא בעל אופי טכנולוגי  או כמותי בשטח הנ. הסביבה או משאבי מים ומדעי הסביבה. הנושא נבחר מתוך רשימה המוצעת ע""י המורה האחראי. או ע""י הסטודנט באישור המורה. הסטודנט לומד את הנושא באופן עצמאי, אוסף מידע ונתונים מספרות, שיחות עם אנשי מקצוע ומגיש את סיכומו בהרצאה ובדו""ח בכתב בהנחיית המורה. על הסטודנטים להיות נוכחים בכל הפגישות ולהשתתף בדיון אחרי כל הרצאה."
014301,פרויקט בהנדסה סביבתית,2.5,"תכנון כללי של פרוייקט בשטח הנדסה סביבתית. לימוד עצמי של בעיה הנדסית. השוואת פתרונות שונים, הכנת תכניות לאחד הפתרונות ודיווח טכני."
014305,מעבדה לטיפול במים ושפכים,2.5,"הערה: הציונים יינתנו עפ""י בחנים ודוחות מעבדה. מטרת הקורס הי ללמד טכניקות של בדיקות מעבדה הקשורות לטיפול במים ושפכים. הדמייה של תהליכי טיפול במים ובשפכים. תרגילי המעבדה כוללים בדיקות וניסויים נבחרים בשיטות כימיות וכימיות-פיסיקליות הקשורות בבקרת איכות מים, מקורות מים, תהליכי הטיפול במים, בשפכים ובבוצה."
014309,טכנולוגיות מים ושפכים,2.5,"מטרת הקורס היא להכיר לסטודנטים תהליכים מתקדמים ועתידיים לטיפול במים ושפכים. החלק הראשון של הקורס מוגדש לעיקרונות התכן של ריאקטורים מנתיים ורציפים לטיפול במים ושפכים. בחלק השני נלמד תהליכי ספיחה, תהליכי חמצון מתקדם, חילוף יונים , שיטות אלקטרוכימיות והידרותרמיות."
014313,מיקרוביולוגיה סביבתית ואפידמיולוג,3,"קבוצות עיקריות של מיקרואורגניזמים ותפקידם בסביבה. פעילות חיידקים בקרקע, ייצור חומרים אנטיביוטים, ביו-קונטרול, טיפול בזיהומי קרקע באמצעות חיידקים. גורל והובלה של חיידקים, פטריות ונגיפים באוויר. פתוגנים במים, הקשר בין חיידקים במים לבריאות הציבור, חיידקים אינדיקטורים לפי תקני מי שתייה, פרזיטים במי שתייה. מבוא לאפידמיולוגיה, אפידמיולוגיה של מים, QUANTITATIVE MICROBIAL RISK ASSESSMENT. ביו-קורוזיה במערכות מים. התהליך הביולוגי בטיפול בשפכים, תהליכי אגירה של מזהמים ( BIOACCUMULATION ), ניטריפיקציה, דנטריפיקציה, הרחקת זרחן. מיקרוביולוגיה של ביו-גז."
014318,הסביבה בעידן הטכנולוגי,2,"הקורס מיועד לכלל הסטודנטים בטכניון ומטרתו להקנות ידע מקיף ויכולת חשיבה ביקורתית בנושאי הסביבה בארץ ובעולם. הקורס יעסוק בהשפעות העידן הטכנולוגי על הסביבה מצד אחד, ושימוש בטכנולוגיות מתקדמות לטיפול בבעיות הסביבתיות שנוצרו מצד שני. הקורס יכלול התייחסות ספציפית לחמישה משאבים מרכזיים: מים, אויר, מזון, אנרגיה והשטחים הפתוחים. כל משאב ייבחן בהיבט של הבעיה הסביבתית העכשווית, ובהיבט של טכנולוגיות זמינות/ עתידיות לטיפול בבעיה."
014321,טוקסיקולוגיה סביבתית,2,"מושגי יסוד בטוקסיקולוגיה קלינית וסביבתית. הגומחה האקולוגית וגורמי הנזק לקיומה. מנגנוני הגנה רקמתיים ותאיים להגנה מפני פעולת מזהמים סביבתיים ונטרול רעילותם. הבנת תהליכים מסרטנים מבחינה גנטית, ביוכימית וקלינית. סיווג מסרטנים. השפעת מתכות, כימיקלים אורגאניים, דשנים וחומרי הדברה על הסביבה והאדם. תרכובות כימיות ופיזורן באוויר, באדמה ובמים. חלקיקים זעירים וננו-טוקסיקולוגיה. כימיקלים זרים (קסנוביוטים) מחוללי הפרעות אנדוקרינית ומחוללי השמנה. מזהמים אורגאניים נצחיים בסביבה. קרינה מייננת ובלתי מייננת סביבתית. חומרי בנייה, ריהוט וציפוי (אסבסט ואחרים). טוקסיקולוגיה של אש. הערכת סיכונים על פי מדדים אפידמיולוגיים. ניהול חיי המוצר ומחזור. אסונות אקולוגיים."
014322,יסודות הטיפול במים ושפכים,2.5,"פיתוח גישה תהליכית-הנדסית לטיפול במים ושפכים. איכות מים לפי שימושים. עקרונות תהליכי טיפול במים. הפרדת מוצקים בלתי מומסים: שיקוע, סינון הפתתה. פרדת מוצקים מומסים. מעבר גזים. חיטוי. מזהמים בשפכים ומשמעותם. טיפול בשפכים, הכולל טיפול פיזיקלי וביולוגי. טיפול בבוצה."
014325,תכן מערכות אספקת מים ואיסוף שפכים,3.5,"עקרונות תכנון והפעלה של מערכות אספקת מים ואיסוף שפכים. חישוב רשתות אספקת מים ורשתות איסוף שפכים. המטרה, המבנה וההכנה של פרויקט הנדסי. מטרות בתכנון הכללי, איסוף נתונים לתכנון ועיבודם, ניתוח טכנו- כלכלי של חלופות והשוואתן. סוגיות בתכנון מערכות אספקת מים ושפכים. פרויקט בתכנון כללי של מערכת טיפול ואספקת מים."
014405,גיאולוגיה הנדסית,2,"מינרלים וסלעים עיקריים, עיקרי הסטרטיגרפיה, מבנים גיאולוגיים, המבנה הגיאולוגי של ישראל, מפות גיאולוגיות. מי תהום, תופעות בליה. מבוא לסיסמולוגיה. *** הערה: היקף ההרצאות בפועל במקצוע הוא שעה וחצי לשבוע. אופן העברת ההוראה מתואמת בכל סמסטר בנפרד ע""י מורה המקצוע."
014409,גיאומכניקה,4,"יחסי משקל נפח, מיון, זרימת מים בקרקע, עקרון המאמצים האפקטיביים, השפעת זרימה על מאמצים אפקטיביים גרדינט קריטי, חתירה. פרוס מאמצים, קונסולידציה, דחיסות של חרסית רוויה, לחץ טרום, שקיעות סופיות, קונסולידציה בזמן, התפתחות שקיעות, חוזק קרקעות.,"
014501,פרויקט בחומרים ותפקוד,2.5,"מקצועות קדם: עבור פרויקט בחומרים - 014505 ו- 014506 ועוד שניים לפחות מבין: 014513, 014515, 014605, 014508, 014512, 014516, 016504, 016505, 014520. תכנון כללי של נושא בשטח חומרי בנייה ותפקוד. לימוד עצמי של בעיה הנדסית, השוואת פתרונות שונים, הכנת תכניות לאחד הפתרונות ודיווח טכני."
014503,פרויקט מעבדתי בחומרי בניה (1),0,"פרוייקט מעבדתי לפי בחירת הסטודנט מרשימת נושאים שתינתן על ידי המורה האחראי. לימוד עצמי של בעיה הנדסית בשטח חומרי בנייה ובחינת הפתרונות האפשריים על ידי ניסויים מעבדתיים. ניתוח וסיכום תוצאות הבדיקות. הפרוייקט מבוצע בקבוצות בנות 2 סטודנטים ומסתיים בהגשת הרצאה בע""פ ודו""ח מקיף בכתב. הפרוייקט נמשך 2 סמסטרים וחלק זה מהווה קדם להמשך הפרוייקט 014504."
014504,פרויקט מעבדתי בחומרי בניה (2),4,המשך הפרוייקט  014503.
014505,חומרי בנייה,3.5,"חומרי המליטה השונים. סיד אווירי ומוצרי חול סיד. גבס ומוצרי גבס, צמנט פורטלנד, הרכב כימי ומינרלי, סוגים. חומרים פוצולניים ותחליפי צמנט. התקשרות והתקשות, מבנה האבן הצמנטית, תכונות מכניות, שינויי נפח, קורוזיה. אגרגטים למלט ובטון - תכונות ודרישות איכות. מים. מוספים. תכונות הבטון הטרי והקשוי. יציקה ואשפרה, בקרת איכות, קיימות. בדיקת חומרים ומשמעותה. תכן תערובות בטון, הכנתן במעבדה ובדיקת תכונותיהן.% הערה: תרגילי המעבדה ניתנים אחת לשבועיים."
014506,טכנולוגיה מתקדמת של בטון,2,"התנהגות בטון במבנה - שינויי נפח וסדקים והאמצעים להקטנתם. בטונים מיוחדים ליציקות באתר ובתעשיה. פתרון בעיה ספציפית בטכנולוגיה של בטון במעבדה כולל: סקר ספרותי, ביקור באתרי בנייה ובתי חרושת במידת הצורך, עיבוד תוכנית ניסויים, בדיקות מוקדמות, תכן תערובת בטון, יציקת מדגמים, בדיקתם והערכת התוצאות. דווח בעל-פה ובכתב."
