number,name,credit,sylabus
234230,השתלמות עצמית 1,2,מיועד לסטודנטים בשלבי לימודים מתקדמים (שצברו לפחות 80 נקודות) ובעלי השגים טובים בלימודים (ממוצע מצטבר לפחות 80). ההשתלמות תעשה בהנחית חבר סגל הפקולטה ובאישור מרכז לימודי הסמכה בפקולטה.
234231,השתלמות עצמית 2,2,מיועד לסטודנטים בשלבי לימודים מתקדמים (שצברו לפחות 90 נקודות) ובעלי השגים טובים בלימודים (ממוצע מצטבר לפחות 85). ההשתלמות תעשה בהנחית חבר סגל הפקולטה ובאישור מרכז לימודי הסמכה בפקולטה.
234247,אלגוריתמים 1,3,"הקורס עוסק בשיטות בסיסיות לתיכון וניתוח אלגוריתמים, כולל שיטות סריקה, אלגוריתמים חמדנים, תכנון דינמי, רדוקציות, מסלולים משפרים, אלגוריתמים הסתברותיים, ושיטות אלגבריות. בקורס מציגים אלגוריתמים יעילים לשאלות יסוד בתורת הגרפים ובתחומים אחרים. בין השאר דנים בנושאים הבאים: סריקה לרוחב, סריקה לעומק, עץ פורש מינימום, מסלולים קלים ביותר, זרימה ברשתות, חתכים, התאמת מחרוזות, בעיות גיאומטריות ואלגבריות. הקורס מיועד לסטודנטים של מדעי המחשב."
234290,פרויקט 1 במדעי המחשב,0.5,"מיועד לסטודנטים בסמסטר אחרון ללימודיהם, שחסרה להם 0.5 נקודה להשלמת התואר. הסטודנט יבצע פרויקט בהנחית חבר סגל הפקולטה. קורס זה אינו נחשב כפרויקט לענין קיום דרישות הפרויקטים לתואר."
234291,פרויקט 2 במדעי המחשב,1,"מיועד לסטודנטים בסמסטר אחרון ללימודיהם, שחסרה להם 1.0 נקודה להשלמת התואר. הסטודנט יבצע פרויקט בהנחית חבר סגל הפקולטה. קורס זה אינו נחשב כפרויקט לענין קיום דרישות הפרויקטים לתואר."
234292,לוגיקה למדעי המחשב,3,"תחשיב הפסוקים ותחשיב היחסים: הגדרת התחשיבים, סמנטיקה, מערכות הוכחה, משפטי שלמות ונאותות, משפטי קומפקטיות ושימושיהם."
234304,פרויקט בבינה מלאכותית ה',3,קורס זה כולל פרויקט גדול בבינה מלאכותית. הסטודנטים יעבדו יחידים או בצוותים בהנחיה צמודה של אסיסטנט.
234311,פרויקט שנתי בהנדסת תוכנה-שלב א',3,"קורס זה אינו נחשב כפרויקט לענין קיום דרישות הסיום. קורס זה יחד עם הקורס פרויקט שנתי בהנדסת תוכנה-שלב ב' (234312) מהווים יחידה אחת המוקדשת לתכנון ולמימוש של פרויקט תוכנה גדול שיתבצע במשך שני סמסטרים עוקבים. הסטודנטים עובדים בצוותים בהנחיתו של חבר סגל בכיר. בקורס נלמד תהליך פיתוח תוכנה ומבוצעים שלבי ניתוח הדרישות. תכן על, תכן מפורט ובנית אב-טיפוס ראשוני. הציון יקבע על פי דו""חות ביניים, דו""ח מסכם ואיכות אב-טיפוס שימומש בשלב זה."
234313,פרויקט תעשייתי,3,"פרויקט תוכנה בהיקף של 3 נק', המתבצע בעקרון ע""י זוג סטודנטים (120 שעות עבודה לסטודנט). נושאי הפרוייקטים מתקבלים מחברות תוכנה בתחילת הסמסטר במגוון נושאים במדעי המחשב. הנחיית הפרויקט ע""י מנחה מהתעשייה, בפיקוח אחראי אקדמי מטעם הפקולטה. הפרויקט יקנה לסטודנטים נסיון בביצוע פרויקט הנגזר מה""עולם האמיתי"" תוך שימוש בכלי פיתוח וסביבות עבודה מודרניות לפיתוח תוכנה והתמודדות עם הבעיות האופייניות המתעוררות בתהליכי פיתוח. בסוף הפרויקט, מוצר התוכנה מוגש בליווי תיעוד הולם ודו""ח מסכם."
234325,גרפיקה ממוחשבת 1,3,"שימושים של גרפיקה ממוחשבת ומערכות גרפיות מתקדמות. גרפיקה רסטרית וגיאומטריה על הסריג הדיסקרטי. טרנספורמציות דו- ותלת-ממדיות. יצוג ותצוגה של עקומים ומשטחים פרמטריים ושל גופים תלת ממדיים. הסרת הבלתי נראה, מודלים של הצלה והצללה, מיפוי מרקמים, ומודלים של צבע."
234329,פרויקט בעיבוד וניתוח תמונות,4,קורס זה מיועד לביצוע פרויקט רחב בהיקפו בנושאים של ראיה ממוחשבת ועיבוד תמונות. הסטודנטים יעבדו בצוותים קטנים (2) בהנחיה צמודה של אסיסטנטים ובפיקוח סגל בכיר.
236001,מבוא למחקר פקולטי במדעי המחשב,1,"הקורס יחשוף בפני הסטודנטים את מגוון נושאי המחקר בפקולטה וכיווני מחקר עכשוויים על מנת לעזור בבחירת נושא מחקר ומנחה בלימודים מתקדמים. הקורס יהיה מורכב מהרצאה שבועית שתינתן על ידי חברי הסגל בפקולטה, ומיועד עבור סטודנטים המתחילים תואר שני ועדיין אין להם מנחה, וסטודנטים בסוף תואר ראשון עם ממוצע גבוה המעוניינים להמשיך ללימודים מתקדמים בפקולטה. רישום לקורס באישור המרצה. תוצאות למידה: בסיום הקורס הסטודנט: 1) יכיר את נושאי המחקר השונים בפקולטה. 2) ירכוש כלים עבור בחירת נושא מחקר ומנחה לתואר שני."
236200,"עיבוד אותות, תמונות ומידע",4,"הקורס עוסק בשיטות בסיסיות לעיבוד וניתוח אותות ומקורות מידע בכלים דטרמיניסטיים והסתברותיים. נושאי הקורס: אפיון אותות ומערכות בשריג בדיד, ניתוח פורייה למערכות ליניאריות קבועות בזמן, ייצוג ועיבוד אותות במרחבים אלגבריים, שערוך סטטיסטי - סבירות מרבית, שיטות בייסיאניות, יסודות באותות אקראיים - תהליכי וינר, פואסון ומרקוב, סינון ליניארי, רעש אקראי, מודלים פרמטריים של תהליכים אקראיים ושערוכם, חסם קרמר-ראו, חיזוי ליניארי ואלגוריתמים אדפטיביים. הוכחת אופטימליות ויחידות של ייצוגי פורייה קצוצים לאותות בעלי אנרגית דיריכלה חסומה, קירוב לבעיית האשכול, ומבוא למיפויים פונקציונליים.%תוצאות למידה: בסיום הקורס הסטודנט ידע:% 1. לאפיין מערכת ליניארית קבועה בזמן ולקשור את ניתוחה לתחום התדר%.2. לערוך המרה של ייצוג האותות, בחשיבה של מטריצות המייצגות מערכות ליניאריות ווקטורים המייצגים אותות.%3. להפעיל כלי שערוך סטטיסטי, פרמטרי וישיר למגוון בעיות יסוד בעיבוד מידע.%4. להפעיל שיטות סינון ליניארי, כגון מסנן וינר, למידע אקראי רועש.%5. לקבוע חסמי ביצועים על בעיות שערוך."
236267,מבנה מחשבים,3,"מדדי ביצועים והקשר בינם לבין ארכיטקטורות, שיטות למדידת ביצועים. תלויות בקרה וחיזוי קפיצות. עקרון זרם מידע (DATAFLOW), שבירת תלויות מדומות. מעבדים סופרסקלרים ( OUT-OF-ORDER, VLIW).  מערכת הזיכרון ומערכת האחסון. טכנולוגיות זיכרון ומגבלותיהן,  זיכרונות מטמון, היררכיית מטמונים, קוהרנטיות מטמונים וקונסיסטנטיות זיכרון. זיכרון מדומה, תרגום מהיר של כתובות ,(TLB) הרחבות למכונות וירטואליות. ריבוי חוטים בחומרה ( SMT, GPGPU). מעבדים בעלי קונפיגורציה משתנה (FPGA , CGRA). תוצאות למידה: בסיום הקורס, הסטודנט יהיה מסוגל להבין:% 1. את אבני הבניין של המחשב, את אופן העבודה של מעבדים מודרנים, ושיטות לתכנון.% 2. מדדים לביצועי מעבדים ומערכת המחשב.% 3. חשיבה ביקורתית בתכנון מעבדים ושיקולי תכנון מערכתיים.% 4. הקשרים וההשפעות ההדדיות בין רכיבי המעבד ומערכת המחשב."
236304,לוגיקה למדעי המחשב 2,3,"הקורס עוסק בשלושה נושאים: משפטי אי השלמות של גדל, כולל הכרות עם מערכת אכסיומטית לתורת המספרים, יסודות תורת הרקורסיה והתזה של צ'רץ. תורת הקבוצות: יסודות אכסיומטיים וקומבינטוריים והצגת התחום כבסיס לפיתוח המתמטיקה. לוגיקה מודאלית: מודלים של קריפקה, משפטי שלמות, דיון בענפים בעלי השלכות למדעי המחשב: לוגיקות זמן, ידיעה ועוד."
236306,גרפים מקריים,2,"מודל ארדש-רניי. האבולוציה של גרף מקרי. קשירות. הופעה של תת-גרפים. ספים חדים וקהים. מספר קליקה ומספר צביעה. בעיית הקליקה השתולה. גרף רגולרי מקרי. גרפים מרחיבים. תוצאות למידה: בסיום הקורס הסטודנט: 1) יכיר את שני המודלים המרכזיים של גרפים מקריים: גרף ארדש-רניי, וגרף רגולרי מקרי. 2) ידע לנתח את ההתנהגות של גרפים מקריים בשני המודלים. 3) יכיר טכניקות הסתברותיות רלוונטיות, כגון אי-שוויון מרקוב, אי-שוויון צ'בישב, אי-שוויון צ'רנוף, אי-שוויון אזומה, אי-שוויון ינסון, ושיטת הקירוב הפואסוני."
236309,מבוא לתורת הצפינה,3,"מושגי יסוד: תיקון שגיאות, גילוי שגיאות ותיקון מחיקות. קודים לינאריים. קודי HAMMING. מבוא לתורת השדות הסופיים. קודי REED-SOLOMON, קודי BCH וקודי ALTERNANT. אלגוריתמי פענוח. חסמים על הפרמטרים של קודים לתיקון שגיאות."
236319,שפות תכנות,3,"ניתוח השוואתי של מושגים יסודיים בתחום שפות התכנות בשלוש פרדיגמות תכנותיות: ציוויית, פונקציונלית  ולוגית/הצהרתית. המושגים הנדונים כוללים קישור, סדר שיערוך, פקודות, ערכים, טיפוסים, פולימורפיזם, והכללות של מבנה הפונקציה, מחסנית, איסוף אשפה ועוד. שפות התכנות הנדונות כוללות את פסקל ML, פרולוג C, ו- JAVA - והדגמה ממגוון של שפות אחרות. תוצאות למידה: בסיום הקורס הסטודנט יהיה מסוגל: % 1. ללמוד באורח יעיל, אפקטיבי ומהיר שפת תכנות לא מוכרת, כולל שימוש במבנים מתקדמים שבה.% 2. להעריך שפת תכנות, מבלי ללמוד לתכנת בה, מתוך האפיון שלה באמצעות מונחים נפוצים כגון פרדיגמה, טיפוסיות סטטית, קישור דינמי , סגור, וכד'.% 3. לתכנת במבנים מתקדמים בשפות פונקציונליות ולוגיות."
236322,מערכות אחסון מידע,3,"התקני אחסון: זיכרון, פלאש ודיסקים קשיחים, מערכי דיסקים. מסדי נתונים רלציוניים ומאגרי מפתח-ערך. פעולות על קבצים ומסדי נתונים: מיון, תזמון חוצצים, MAPREDUCE. מבני נתונים בזיכרון משני: עצים, ערבול, ערבול מבוזר, ואינדקסים מורכבים. בקרת מקביליות: סדרתיות, מנעולים ופרוטוקולים מבוססי מנעולים וחותמות-זמן, מקביליות במסדי נתונים מבוזרים. שרידות: התאוששות, שיכפול.% תוצאות למידה: בסיום הקורס הסטודנט יהיה מסוגל:% 1. להבין את היתרונות והמגבלות של אמצעי אחסון מסוגים שונים.% 2. להשתמש באלגוריתמים ובמבני אינדקס שונים לביצוע פעולות (כגון מיון) וחישוב שאילתות על מידע השמור בזיכרון המשני.% 3. להבין פתרונות שונים לבעיות הנובעות ממקביליות בעיבוד נתונים במערכות אחסון. % 4. להתמודד עם נפילות במערכת ולהשתמש ביומן ובשכפול להשגת שרידות של נתונים.% 5. להבין את העקרונות של מערכות קבצים מבוזרים."
236323,פרויקט בעיבוד נתונים מ',3,"בקורס זה יפתחו הסטודנטים פרוייקט גדול בעיבוד נתונים. פיתוח הפרוייקט יכלול את שלבי האיפיון, התיכון והיישום, כאשר כל שלב ילווה בתיק תיעוד מפורט. הפרוייקט ייושם על מערכת ניהול מסד נתונים. העבודה תתבצע בצוותים של 3-4 סטודנטים, בהנחית המרצה. חומר רקע בנושאי הפרויקט יועבר בתחילת הקורס."
236328,פרוייקט בגרפיקה ממוחשבת מ',3,"פרוייקט על ציוד גרפי שיבוצע ע""י הסטודנטים ביחידים או בקבוצות קטנות בהשגחת אסיסטנטים ובהדרכת איש סגל בכיר."
236332,האינטרנט של הדברים - טכנולוגיות,2,"רקע תאורטי של טכנולוגית ה- IOT וכלים לפיתוח של פרויקט מעשי של מערכות IOT חכמות המשלבות שרותי אחסון ומחשוב עננים, טלפונים חכמים ומיקרו בקרים. הרקע התאורטי מכיל מבוא ל- IOT, מבוא ל- BIG DATA במערכות IOT, פרקים נבחרים בתקשורת מחשבים, רשתות אלחוט ומחשוב עננים, וסקירה של בעיות בהגנת מערכות ממוחשבות עם דגש על IOT. בנוסף, הקורס מכיל מבוא לתכנות מיקרו בקרי IOT ומבוא לאלקטרוניקה בסיסית. תוצאות למידה: בסיום הקורס הסטודנט יהיה מסוגל: - להבין את הסביבה שבה פועלים מוצרי IOT, - להבין כיצד עובדת תקשורת נתונים אלחוטית במערכות IOT, - להבין את בעיות אבטחת התוכנה במערכות IOT, - לתכנן מעגל בסיסי באלקטרוניקה ואפליקציות חומרה ותוכנה עם בקרי ארדואינו, - לבנות יישומי IOT בבית חכם, ערים חכמות ועוד, המשתמשים במחשוב עננים ובטלפון חכם."
236333,פרויקט באינטרנט של הדברים,3,"קורס זה נחשב כפרויקט לעניין קיום דרישות הסיום. במסגרת הפרויקט יפתחו הסטודנטים אב טיפוס למוצר IOT. מוצר זה משלב תכנות מבוסס שירותי ענן, טלפון חכם, מיקרו-בקרים וחומרות שונות. העבודה מתבצעת בקבוצות של 3-2 סטודנטים. בסיום הקורס מוצג מוצר ומוגש דו""ח כתוב. תוצאות למידה: בסיום הקורס הסטודנט יהיה מסוגל: לתכנן ולבנות יישומי IOT משולבי חומרה ותוכנה המבוססים על בקרי ארדואינו ומשתמשים במחשוב עננים ובטלפון חכם."
236334,מבוא לרשתות מחשבים,3,"רשתות PACKET SWITCHING לעומת רשתות CIRCUIT SWITCHING. מודל השכבות, קודים לגילוי ולתיקון שגיאות, פרוטוקול ARQ לשכת הקו, תורת התורים, תת השכבה לבקרת הגישה לערוצים משותפים, רשתות ETHERNET, רשתות סלולריות, רשתות אלחוטיות, ערוצי SONET ורשתות טבעת, גישור רשתות מקומיות, מבוא לאינטרנט ולפרוטוקולי TCP/IP."
236340,פרויקט בתקשורת מחשבים,3,"מטרת הפרויקט להעמיק את הידע של הסטודנטים בפרוטוקולי תקשורת ולאפשר להם להתנסות במחקר ובפיתוח של פרוטוקולים אלה. הסטודנטים יבצעו פרויקט מקיף וחדשני בתחומים שהם בקדמת הטכנולוגיה של רשתות תקשורת מחשבים והאינטרנט. הפרויקט יבוצע בד""כ על פלטפורמת LINUX תוך שימוש בכלים מתקדמים לסימולציה של רשתות. תוצאות למידה: בסיום הפרויקט הסטודנט יהיה מסוגל לבצע מטלות תכנותיות מורכבות הקשורות לפרוטוקולי תקשורת וטכנולוגיות רשת חדשניות."
236342,מבוא לאימות תוכנה,3,"הכרת שיטות שונות לאימות תכניות ביחס למפרטים נתונים. הקורס מורכב משני חלקים. החלק הראשון סוקר שיטות דדוקטיביות. החלק השני סוקר שיטות בדיקת מודל. גישה דדוקטיבית (תכניות קלט-פלט): נכונות חלקית ועצירה של תכניות תרשימי זרימה. הגישה המצרפית-נכונות חלקית ועצירה. גישת בדיקת-מודל (תכניות תגובתיות): לוגיקות טמפורליות פסוקיות ומבני קריפקה. בדיקת מודל CTL עם הוגנות. הצגת BDDS ושימושיהם. בדיקת מודל סימבולית מבוססת BDDS. בדיקת מודל סימבולית חסומה, מבוססת SAT. הכרה והפעלה של כלי תוכנה לבדיקת-מודל."
236343,תורת החישוביות,3,"מכונות טורינג, מודלי חישוב שונים ושקילותם למכונות טורינג. התזה של צ'רץ. מושג המכונה האוניברסלית. בעיות בלתי כריעות. סיבוכיות זמן וסיבוכיות מקום. מושג הרדוקציה והרדוקציה הפולינומית. חסמים לחישוב דטרמיניסטי ולא דטרמיניסטי והקשר ביניהם. משפט קוק."
236349,פרויקט באבטחת מידע,3,"במסגרת קורס זה הסטודנטים יתכננו, יממשו ויתעדו פרויקטים שונים בנושאי אבטחת מידע. הסטודנטים יעבדו בהנחיה צמודה."
236350,הגנה ברשתות,3,"מבוא להגנה על מערכות מתוכנתות. הגנה על רשתות מחשבים. חולשות אבטחה. חומות אש. עקרונות תכן בסיסיים. יסודות: סודיות, פרטיות, שלמות, אימות מקור. רקע בקריפטוגרפיה. פרוטוקולי הזדהות ובקרת כניסה. פרוטוקולי אבטחה ברשתות: IPSEC ו-SSL/TLS. אבטחת תקשורת אלחוטית (כולל WEP וחולשותיה). וירוסים ותולעים. PGP. %"
236351,מערכות מבוזרות,3,נושאים בתכן ויישום של מערכות מבוזרות. 1) מודל השרת/לקוח תוך שימת דגש על סביבת ה-NET ו- WEB SERVICES 2) בעית הקונסנזוס וגילו נפילות. 3) שיכפול ותקשורת קבוצתית. 4) עסקות מובזרות ובעית ה- ATOMIC COMMIT 5) מערכות PEER-TO-PEEAR 6) PUBLISH/SUBSCRIBE (7 CHECKPONT/RESTART ומערכות אכסון מבוזרות.
236356,תאוריה של מערכות מסד נתונים,3,"דגש על המודל היחסי (רלציוני) למסדי נתונים. תכנון סכימת מסד נתונים, צורות נורמליות ומשמעותן. תורת התלויות. תלויות פונקציונליות ורב-ערכיות, כריעות בעית התלויות המושרות. שפות שאילתא, הגדרת משמעות ושלמות. סכימות מעגליות ובלתי מעגליות. השלכות לגבי תכנון סכימות ובנית תשובות לשאילתות.  יסודות בתורת הבקרה המקבילית."
236360,תורת הקומפילציה,3,"שפות ודקדוק.  מבנה מהדר. שיטות פריסה בסיסיות. תרגום מכוון ע""י תחביר. טבלות סמלים.  ארגון בזמן ריצה, יצירת קוד. אופטימיזציה מקומית וגלובלית."
236363,מסדי נתונים,3,"הנושאים הבסיסיים בתאוריה וישום של ניהול מסדי נתונים: המודלים הרלציוני והלוגי. שפות שאילתה: SQL, אלגברה רלציונית (RA) ותחשיב רלציוני (CRD). תכנון מסדי נתונים: דיאגרמות ישויות וקשרים (ERD), תלויות בין נתונים וצורות נורמליות. מידע מובנה למחצה: שפת XML כולל DTD ושפות השאילתה XPATH ו-XQUERY."
236366,פרויקט במערכות הפעלה מ',3,"פרויקט מעשי בנושא מחקרי בתחומים שנוגעים למערכות הפעלה כגון וירטואליזציה, מערכות אחסון, מערכות תקשורת, אבטחת מערכות ומערכות ענן. תוצאות למידה: הסטודנטים יתנסו בעבודה מחקרית בנושא מתקדם במערכות הפעלה."
236369,ניהול מידע ברשת האינטרנט,3,"הקורס עוסק בניהול מידע ברשת האינטרנט (WORLD-WIDE WEB). הקורס מלמד טכנולוגיות ועקרונות לייצוג מידע ברשת האינטרנט, העברת מידע בין גורמים מרוחקים, והצגת המידע למשתמשי הקצה. בפרט, הקורס מלמד את העקרונות השונים בבסיס הטכנולוגיות, הפרוטוקולים, והשפות לפיתוח אתרים ויישומים באינטרנט. בצד הלקוח, הקורס מלמד את הבסיס ל-HTML, XML, CSS, ו-DOM, וכן את יסודות JAVASCRIPT ו-JSON ליצירת תוכן דינמי באינטרנט. בצד השרת, הקורס עוסק בתקשורת HTTP, עקרונות בניית שרת, עבודה עם מסד הנתונים, והתנהלות בסביבה מרובת משתמשים ובקשות. לבסוף, הסטודנטים מתנסים בפיתוח בפלטפורמת FULL STACK, ולומדים את העקרונות שבבסיסה. דרישות הקורס: יינתנו חמישה תרגילי בית, השניים האחרונים מהווים פרויקט מסכם שיוצג בפני סגל הקורס. הציון הסופי יהיה מורכב מציון תרגילי הבית והפרויקט המסכם._% תוצאות הלמידה: בסיום הקורס הסטודנט:% 1) יכיר את היסודות של שרתי האינטרנט ושפות התקשורת שלהם (HTTP) עם יישומי המשתמשים.% 2) יכיר את יסודות התכנות של דפי אינטרנט דינמיים, וירכוש ניסיון בבניית שרת אינטרנט,דף אינטרנט ופיתוח יישום מלא בפלטפורמה ייעודית."
236370,תכנות מקבילי ומבוזר,3,"סקירת שפות תכנות ומנגנונים לסינכרון ולתקשורת בין תהליכים. מבני בקרה: MONITORS ,RENDEZVOUS, העברת הודעות של CSP. בעיות מיוחדות: מניעה הדדית, חבק, רעב, סיום גלובלי. חלוקת תכנית לתהליכים: תכונות של ""חיות"" ו""הוגנות"". פיתוח תכנית מקבילית נכונה ויעילה. הקורס כולל תרגילי תכנות."
