number,name,credit,sylabus
114051,פיסיקה 1,2.5,"*** מקצועות קדם: בחינת סווג בפיסיקה חלק א' - מכניקה או פטור ממנה.*** המקצוע מכיל נושאים במכניקה קלסית. א. מכניקה ניוטונית: הבחנה בין כוחות פנימיים וחצוניים, שימור אנרגיה. תנע ותנע זויתי (למערכת חלקיקים ללא כוחות חיצוניים). דוגמאות של משואות תנועה, טרנספורמצית גלילאי, מערכות מואצות. ב. תורת היחסות הפרטית: מדידת מהירות האור ותכונותיה, עקרון היחסות, טרנספורמצית לורנץ, זמן עצמי, תופעת דופלר יחסותית, אנרגיה ותנע יחסותיים, פיזור, יצירה והתפרקות של חלקיקים."
114052,פיסיקה 2,3.5,"***מקצועות קדם: בחינת סווג בפיסיקה חלק ב' - חשמל או פטור ממנה.*** חשמל ומגנטיות: אלקטרוסטטיקה, שדה חשמלי, חוק גאוס, פוטנציאל, קבלים וחומרים דיאלקטריים. חוק אום, מעגלי CR, שדה מגנטי, חוק אמפר, חוק פרדי, השראות, תכונות מגנטיות של חומר, משוואות מקסוול. גלים: גלים מכניים, שרשרת אוסצילטורים, גלי רוחב במיתר, גלים אקוסטיים בנוזל או בגז, תנאי שפה, גלים עומדים: ספקטרום תדרים. גלים מתקדמים: מהירות פאזה ומהירות חבורה, שבירה והחזרה, החזרה מלאה. עקרון הויגנס: עקיפה והתאבכות, פיזור בראג. גלים אלקטרומגנטיים בריק, קיטוב."
114054,פיסיקה 3,3.5,"רקע ויסודות המכניקה הקונטית - תכונות חלקיקיות של אור, תכונות גליות של חומר, קונטיזציה של קרינה ואנרגיה. מודל האטום של בוהר, גילוי הגרעין ע""י רתרפורד, פונקצית גל ומשואות שרדינגר - הגישה ההסתברותית, פתרון משואת שרדינגר לחלקיק חופשי ובנוכחות פוטנציאלים שונים. תאור קונטי של אטום המימן, אטומים רבי אלקטרונים והטבלה המחזורית. מצב מוצק - מבנה המוצק, מודל אלקטרונים חפשיים, מבנה פסים, מוליכים, מבדדים, ומוליכים למחצה. גרעין - מבנה הגרעין, כוחות גרעיניים ואנרגית קשר, רדיואקטיביות, ראקציות גרעיניות, ביקוע, מיזוג ואנרגיה גרעינית. חלקיקים יסודיים - חלקיקים ואנטי חלקיקים, חוקי שימור, מיון חלקיקים, הכוחות הבסיסיים בטבע. אסטרופיסיקה וקוסמולוגיה - התפתחות כוכבים ובריאת היקום."
114071,פיסיקה 1מ,3.5,"***מקצועות קדם: בחינת סווג בפיסיקה חלק א' - מכניקה או פטור ממנה.*** מכניקה קלסית- חוקי ניוטון. דינמיקה של חלקיק. טרנספורמצית גליליי. תאור תנועה במערכות לא-אינרציאליות. חוקי השימור של האנרגיה, התנע הקוי והתנע הזויתי. מערכות רבות חלקיקים. דינמיקה של גוף צפיד. אוסצילטור הרמוני. גרביטציה. מכניקה יחסותית - טרנספורמציות לורנץ לוקטורים של מקום-זמן ותנע-אנרגיה טרנספורמציה של וקטור המהירות. דינמיקה יחסותית. חלקיקים עם מסת מנוחה השווה לאפס."
114073,פיסיקה 3ח',3.5,"דואליות גל-חלקיק: אפקט פוטואלקטרי, קרינת X, פיזור בראג, גלי דה-ברולי, עיקרון אי-הוודאות של הייזנברג. מבנה האטום: פיזור רתרפורד, ספקטרום אטומי, מודל האטום לפי בוהר. יסודות תורת הקוונטים:  משוואת שרדינגר, בור פוטנציאל חד-מימדי, אוסצילטור הרמוני, בעיות פיזור, מינהור, חלקיק בתיבה, ניוון, הנחות יסוד של תורת הקוונטים, אופרטורים, יחסי חילוף, סימון דיראק, תורת ההפרעות. פיזיקה אטומית: אטום המימן לפי שרדינגר, ספין ונסוי שטרן-גרלך, אפקט זימן,  עקרון האיסור של פאולי, אטומים מרובי אלקטרונים והטבלה המחזורית."
114074,פיסיקה 1פ',5,"מקצוע קדם: בחינת סיווג בפיסיקה חלק א' - מכניקה או פטור ממנה. חוקי ניוטון, טרנספורמציית גליליי. מערכות לא אינרציאליות. שימור אנרגיה, תנע קווי וזוויתי. מערכות רבות חלקיקים. דינמיקה של גוף צפיד. תנועה הרמונית מאולצת ומרוסנת. גרביטציה ותנועה קפלרית. פרצסיה. מכניקה יחסותית-טרנספומציות לורנץ לוקטורים של מקום-זמן ותנע-אנרגיה. טרנספורמציה של וקטור המהירות. דינמיקה יחסותית. פוטונים."
114075,פיסיקה 2ממ,5,"*** מקצועות קדם: בחינת סווג בפיסיקה חלק ב' - חשמל או פטור ממנה. מקצועות צמודים:(104013 ו- 104035) או 104032. אלקטרוסטטיקה, שדה ופוטנציאל חשמליים, הזרם החשמלי, השדות המלווים מטען נע, שדה מגנטי, השראות, משוואות מקסוול ופתרונם, מעגלי זרם חילופין. מבוא לגלים, נפיצה, שבירה, מהירות פזה וחבורה, תנע ואנרגיה של גל אלקטרומגנטי, קיטוב, התאבכות ועקיפה."
114077,פיסיקה 1ל,2.5,"המקצוע מכיל נושאים במכניקה קלסית. א. מכניקה ניוטונית: הבחנה בין כוחות פנימיים וחיצוניים. שימור אנרגיה. תנע ותנע זויתי (למערכת חלקיקים ללא כוחות חיצוניים). דוגמאות של משואות תנועה, טרנספורמצית גלילאו, מערכות מואצות. ב. תורת היחסות הפרטית: מדידת מהירות האור ותכונותיה, עקרון היחסות, טרנספורמצית לורנץ, זמן עצמי. תופעת דופלר יחסותית. אנרגיה ותנע יחסותיים. יצירה והתפרקות של חלקיקים."
114078,פיסיקה 2ל,3.5,"אלקטרוסטטיקה, שדה חשמלי, חוק גאוס, פוטנציאל, קבלים וחומרים דיאלקטריים, חוקי אום וקירכהוף, מעגלי CR, שדה מגנטי, חוקי אמפר ופרדיי, השראות, תכונות מגנטיות של חומר, משוואות מכסוול. אופטיקה גאומטרית. גלי רוחב במיתר, גלים אקוסטיים. גלים עומדים. גלים מתקדמים: מהירות פאזה וחבורה, שבירה והחזרה, עקיפה והתאבכות, פיזור בראג. גלים אלקטרומגנטיים בריק ובחומר. קיטוב ואנרגיה של גלים."
114081,מעבדה לפיסיקה 1,1.5,"הערכת דיוק מדידה וחישוב שגיאות, תנועה קוית, תנועה מחזורית, כוח ואנרגיה פוטנציאלית, תנע זויתי ומומנטי התמד, תהודה מכנית, פעימות."
114082,מעבדה לפיסיקה 2,1.5,"ניסויים בחשמל, בגלים (אור וקול) ובפיסיקה מודרנית."
114086,גלים,3.5,"אוסילטור הרמוני, אוסילטורים מצומדיים, מודים עצמיים, מערכות רציפות, סופרפוזיציה, גלים נוסעים ועומדים, יחס נפיצה, חבילת גלים, מהירות פאזה וחבורה, העברה והחזרה, פעימות ומודולציה, גלים ב-2 ו-3 מימדים, גלים אלקטרומגנטיים, קיטוב, התאבכות, עקרון הויגנס, סריג דיפרקציה, קרינה, אינדקס שבירה, חוק סנל, מבוא למכניקת קוונטים."
114101,מכניקה אנליטית,4,"סקירת המכניקה הניוטונית, עקרונות וריאציה ומשוואת לגרנג', חוקי שימור, כוח מרכזי והתנועה של שני חלקיקים, פיזור, תנועת גוף קשיח, סיבובים, זויות אוילר, טנסור ההתמדה, תנועת הסביבון, תנודות קטנות, מציאת אופני התנודה כבעיה של ערכים עצמיים, הפורמליזם הקנוני, ההמילטוניאן, טרנספורמציות קנוניות, סוגרי פואסון, משפט ליוביל. משואת המילטון יעקובי."
114208,מעבדה במדידות אופטיות,3,"הערה: מיועד רק לתואר ארבע שנתי בפיסיקה. **השתתפות בהרצאת בטיחות בלייזר - תנאי הכרחי להשתתפות במעבדה.** 1. מדידה אינטרפרומטרית של חזית גל, וניתוח ממוחשב. 2. ספקטרוסקופית פליטה ברזולוציה גבוהה ( FABRY-PEROT ). 3. ספקטרוסקופית פורייה ( FOURIER ) באינפרא-אדום. 4. חקירת רזולוציה מרחבית במערכות דימות (פונקצית ממסר אופטי). 5. מיקרוסקופית קיטוב. 6. מדידות תרמיות ומגנטיות ע""י התאבכות בסיבים אופטיים. 7. אפקט SAGNAC: מדידת סיבוב וגירוסקופיה אופטית."
114229,פרויקט,4.5,הערה: לאחר הרישום יש לתאם עם המורה האחראי למקצוע. המטרה: לאפשר לסטודנט להשתתף במחקר באחד משטחי המחקר הפעילים בפקולטה. לשם לימוד הקורס על הסטודנט לצבור 90 נקודות.
114248,פיסיקה 1 ר,3.5,"מיועד לתלמידי רפואה בלבד. מקצועות קדם: בחינת סווג בפיסיקה חלק א'-מכניקה או פטור ממנה. וקטורים, חוקי התנועה של ניוטון, עבודה ואנרגיה, תנועה סיבובית, מומנט כח, תנועה הרמונית פשוטה, הידרוסטטיקה והידרודינמיקה."
114250,מעבדה לפיסיקה 5ת,3,"** השתתפות בהרצאת בטיחות בלייזר - תנאי הכרחי להשתתפות במעבדה.** ביצוע 2 ניסויים מתוך השטחים של פיסיקה גרעינית, אופטיקה ומצב מוצק."
114251,מעבדה לפיסיקה 6ת,3,"** השתתפות בהרצאת בטיחות בלייזר - תנאי הכרחי להשתתפות במעבדה.** ביצוע 2 נסויים מתוך השטחים של פיסיקה גרעינית, אופטיקה ומצב מוצק שלא בוצעו במסגרת מעבדה לפיסיקה 5ת."
114252,פרויקט ת,3,הערה: לאחר הרישום יש לתאם עם המורה האחראי למקצוע. המטרה:  לאפשר לסטודנטים להשתתף במחקר באחד משטחי המחקר הפעילים בפקולטה.% לשם לימוד הקורס על הסטודנט לצבור 90 נקודות.
115204,פיסיקה קוונטית 2,5,"ההצגות של הייזנברג ושרדינגר. קשר לדינמיקה קלאסית. תנע זוויתי (צימוד ספין מסילה, המבנה הדק והעל דק, אפקט זימן). המערכה המחזורית (כללי הונד, אכלוס רמות), קשר כימי ומולקולת המימן, אטום ההליום. חלקיקים בשדה מגנטי (רמות לנדאו, אפקט אהרונוב-בוהם). תורת פיזור (כולל גלים חלקיים וקירוב בורן). תורת ההפרעות התלויה בזמן (כולל כלל הזהב של פרמי, בליעה ומעברים קוונטיים). קירוב סמי-קלאסי וכללי בוהר-זומרפלד. יסודות מכניקת הקוונטים (תורת המדידה, BELL , EPR )."
116003,פיסיקה של לייזרים,3.5,"קוהרנטיות זמנית ומרחבית, אינטרפרומטרים. התפשטות קרניים בגלבו. עדשות. התפשטות אלומות גאוסיות, גבול הדיפרקציה. מהודים אופטיים, יציבות ותכנון מהודים. אינטרפרומטר פברי-פרו ושימושיו לניתוח ספקטרום.אינטראקציה של אור ותווך רזוננטי. פליטה ספונטנית. מעברים מאולצים. בליעה והגבר. הרחבה הומוגנית ואי-הומוגנית. רווית ההגבר. יחסי קרמרס-קרוניג. תיאורית הלייזר. לייזרים בעלי 3 ו-4 רמות אנרגיה. משוואות קצב. לייזר חד-אופני ורב-אופני. פולסים קצרים בלייזר ונעילת אופנים."
116028,סמינר בפרקים נבחרים בפיסיקה חורף,2,"הרצאות סמינריוניות ע""י הסטודנטים על פי מאמרים על תגליות ופריצות דרך שנתפרסמו לאחרונה בספרות המקצועית והסמי-פופולרית."
116029,מבוא לביופיסיקה,3.5,"הפיסיקה העומדת בבסיס תאים ביולוגיים, כוחות הבין-מולקולריים והביופיסיקה של אבני הבנין: חלבונים וקרומים. תופעות מעבר במערכות ביולוגיות, קינטיקה של אנזימים ויצירת תבניות מסודרות מאי הסדר המולקולרי. תהליכים חשמליים: מתעלות יונים לתאי עצב ורשתות עצביות."
116030,סמינר בפרקים נבחרים בפיסיקה-אביב,2,"הרצאות סמינריות ע""י הסטודנטים על פי מאמרים על תגליות ופריצות דרך שנתפרסמו לאחרונה בספרות המקצועית והסמי-פופולרית."
116034,מערכות קוונטיות מקרוסקופיות,3,"מבוא היסטורי. גילוי ניסיוני של מוליכות על ונוזליות על, גזים בגבול הקלאסי ובגבול הקוונטי. אורך הגל של DE BROGLIE  ,עיבוי BOSE-EINSTEIN והוכחות הניסיוניות לקיומו, תכונות ניסיוניות של הליום 4 על-נוזלי, מודל שני הנוזלים,קריטריון LANDAU לעל-נוזליות והעירורים היסודיים של על-נוזל,על-נוזל מסתובב .תכונותיו של הליום 4 כנוזל קוונטי מקרוסקופי,תכונות אלקטרומגנטיות ותרמודינמיות בסיסיות של מוליך על, התיאוריה המיקרוסקופית של BCS והשלכותיה,אלקטרודינמיקה של מוליכי-על ע""פ LONDON  וקוונטיזציה של השטף המגנטי,המודל של PIPPARD ואורך הקוהרנטיות, מוליכי  על מסוג I ומסוג II, זרמים קריטיים ודינמיקה של שטף מגנטי במוליכי על, אפקט JOSEPHSON, צומת JOSEPHSON כהתקן קוונטי מקרוסקופי, על מוליכות בטמפרטורות גבוהות, הקשר בין המודל של LONDON ותיאוריה מעברי פאזה של גינזבורג-לנדאו. תוצאות למידה: בסיום הקורס הסטודנט יהיה מסוגל: 1. לקרוא באופן ביקורתי ספרות עדכנית בנושא. 2. לתכנן ניסויים פשוטים. 3. לחשב תכונות פיזיקליות בסיסיות של חומרים קוונטיים מיקרוסקופיים."
116035,תורת הקוונטים של החומר 1,3.5,"תכונות תובלה במוצקים קוונטים סקירה של הקשר החזק, פונקציות ווינר, דינמיקה קלאסית למחצה של אלקטרונים, תנודות קוונטיות, משוואת בולצמן,  תאוריה של תגובה ליניארית, יחסי אונסגר, נוסחת לנדאור, לוקליזציה של אנדרסון, אפקט הול  השלם, טופולוגיה של מבני פסים. תוצאות למידה: בסיום הקורס הסטודנט יהיה מסוגל: 1. לקרוא באופן ביקורתי ספרות עדכנית בנושא. 2. לחשב תכונות טרנספורט בסיסיות של חומרים קוונטיים מעובים."
116040,אינפורמציה קוונטית מתקדמת,2,"ערוץ תקשורת קוונטי, דואליות בין ערוץ למצבים, העתקות חיוביות בהחלט, תיקון שגיאות (KNILL-LAFLAMME,STABILIZER,),  אנטרופיה ותכונותיה, מצבי מצרר, וחישוב חד סטרי במצבי מצרר, המשפט האדיאבטי, חישוב אדיאבטי, מערכות פתוחות , קראוס, משואת לינדבלט, תיקוני שגיאות טופולוגים,  TORIC CODE , הוכחות אבטחה, רשתות טנסוריות, מצבים טופולוגיים, מחלקות סיבוכיות קוונטיות QMA BQP תוצאות למידה: בסיום הקורס הסטודנט יהיה מסוגל: 1. לקרוא באופן ביקורתי ספרות עדכנית בנושא. 2. לבנות אלגוריתמים פשוטים לתיקון שגיאות במערכות קוונטיות. 3. להשתמש בארגז הכלים הסטנדרטי של תורת האינפורמציה הקוונטית."
116041,פיז. של לייזרים ואופטיקה קוונטית,3.5,"קוהרנטיות, קרינה וחומר מגביר במשוואות מקסוול, אלומות אור גאוסיות, תנע זויתי אורביטלי של אלומות אור, מהוד פברי-פרוט, מהודים אופטיים, תיאור קוונטי של אינטראקציה של קרינה וחומר, משוואות קצב של תווך אטומי, רווית הגבר, הלייזר, לזירה רב-אופנית, פולסי לייזר קצרים ונעילת אופני לזירה. %תוצאות למידה% בסיום הקורס הסטודנט יהיה מסוגל: 1. לקרוא באופן ביקורתי ספרות עדכנית בנושא.% 2. לתכנן ניסויים פשוטים במערכות של לייזרים.% 3. לחשב תכונות פיזיקליות של לייזרים והקרינה הנפלטת מהם."
116083,טכנולוגיות קוונטיות,2,"מבוא לאינפורמציה קוונטית ואינטראקציה של אור וחומר. שימושים של תורת הקוונטים במחשוב, סימולציות, תקשורת והצפנה, ומדידות מדויקות. מימושים פיסיקליים מובילים: מעגלי מוליכות-על, יונים ואטומים קרים, מרכזי צבע, נקודות ובורות קוונטים, פוטונים ומערכות מכאניות. בסיום הקורס הסטודנט יהיה מסוגל: 1. לקרוא באופן ביקורתי ספרות עדכנית בנושא. 2. לתכנן ניסויים פשוטים בקיוביטים קוונטיים אופטיים, של על מוליכים, של יונים ואטומים. 3. לחשב תכונות פיזיקליות בסיסיות של קיוביטים פיזיקליים מסוגים שונים."
116105,שיטות סטטיסטיות ונומריות בפיסיקה,2.5,"תורת ההסתברות:קומבינטוריקה,הסתברות מותנית,משפט BAYES,משתנים אקראיים בדידים ורציפים,חוק המספרים הגדולים. % התפלגויות בסיסיות:בינום,פואסון, גאוס,ברייט-ויגנר,חי ושימושיהם בפיסיקה. % שגיאות: סטטיסטיות וסיסטמטיות, משפט הגבול המרכזי. % תורת הדגימה: מעריכים,חי בריבוע,נראות מקסימלית. הפרדת אות מרקע בניסוי פיסיקלי. שיטות סימולציה (מונטה קרלו) מתקדמות.% רשתות נוירונים מלאכותיות בבעיות פיסיקליות. אופטימיזציה של אות ורעש. אינטגרציה נומרית. בחינת השערות והסקת חוקים פיסיקליים מתוך נתונים."
116217,פיסיקה של מצב מוצק,3.5,"נושאים: שריגים וגבישים, שריג הופכי, עקיפת קרני -X, פונונים,משפט בלוך, קרוב אלקטרונים כמעט חופשיים וקרוב אלקטרונים קשורים, דינמיקה של אלקטרונים, חום סגולי, מתכות, מוליכים למחצה, מגנטיות."
116354,אסטרופיסיקה וקוסמולוגיה,3.5,"מערכת השמש וכוכבי לכת מחוץ למערכת השמש. המשוואות הבסיסיות של מבנה כוכבים. התפתחות כוכבים ויצירת ננסים לבנים, כוכבי ניוטרונים וחורים שחורים. יצירת כוכבים מעננים מולקולאריים. שביל החלב וגלקסיות אחרות. מרכזי גלקסיות פעילים וחורים שחורים מסיביים. צבירי גלקסיות, מסה אפלה ומבנה היקום בסקלה גדולה. תיאורית המפץ הגדול וחידת האנרגיה האפלה."
117016,פיסיקת הפלסמה,3.5,הגדרות עיקריות של פרמטרי פלזמה ותהליכי פלזמה. מגנטו-הידרודינמיקה של פלזמה. מבוא לתורה קינטית של פלזמה. מבוא לתרמודינמיקה של פלזמה. תנועת סחיפה של חלקיקים טעונים בפלזמה. גלים ותנודות בפלזמה. מקורות פלזמה. אבחוני פלזמה.
123015,השלמות כימיה,0,"הקורס מחולק לשבעה חלקים: מושגי יסוד, מבנה האטום, הטבלה המחזורית, הקשר הכימי, סטוכיומטריה, שיווי משקל בגזים, חומצות ובסיסים."
124107,כימיה לפיזיקאים מ',4,"אטומים רבי אלקטרונים וקרוב האורביטל (הרטרי-פוק). המערכת המחזורית של היסודות. מתכות ואל-מתכות, חומרים יוניים ומולקולריים. מספר אבוגדרו, נוסחה אמפירית ונוסחת מבנה. משוואות כימיות וסטוכיומרטיה. ההמילטוניאן של מולקולות וקרוב בורן-אופנהיימר. ואריאציה לינארית ואורביטלים מולקולריים. יון מולקולת המימן. מולקולות דו-אטומיות. תנאים לצרוף לינארי אפקטיבי של אורביטלים. גישת הקשר הוולנטי, מולקולות פוליאטומיות, צורות רזוננס, הכלאות ומבנה מרחבי של מולקולות. תרכובות הפחמן: אלקאנים, אלקנים, אלקינים, כהלים, קטונים אמינים וחומצות קרבוכסיליות. תמיסות, ריכוזים, מהירות תגובה, תלות ארהניוס, פרופיל אנרגיה של תגובה. שיווי משקל כימי, שיווי משקל של מים. חומצות ובסיסים חזקים וחלשים, PH. תאים חשמליים, משוואת נרנסט, תאי ריכוז. הקורס יכלול כחמישה מפגשי מעבדות בנושאים: תגובות כימיות וסטוכיומטריה, קינטיקה כימית, חומצות ובסיסים, תאים חשמליים."
124108,כימיה לפיסיקאים,3.5,"אטומים רבי אלקטרונים וקרוב האורביטל (הרטרי-פוק). המערכת המחזורית של היסודות. חומרים יוניים ומולקולריים. מספר אבוגדרו, נוסחה אמפירית ונוסחת מבנה. משוואות כימיות וסטוכיומרטיה. ההמילטוניאן של מולקולות וקרוב בורן-אופנהיימר. ואריאציה לינארית ואורביטלים מולקולריים. יון מולקולת המימן. מולקולות דו-אטומיות. תנאים לצרוף לינארי אפקטיבי של אורביטלים. גישת הקשר הוולנטי, מולקולות פוליאטומיות, צורות רזוננס, הכלאות ומבנה מרחבי של מולקולות. תרכובות הפחמן: אלקאנים, אלקנים, אלקינים, כהלים, קטונים אמינים וחומצות קרבוכסיליות. תמיסות, ריכוזים, מהירות תגובה, תלות ארהניוס, פרופיל אנרגיה של תגובה. שיווי משקל כימי, שיווי משקל של מים. חומצות ובסיסים חזקים וחלשים, PH. תאים חשמליים, משוואת נרנסט, תאי ריכוז. הקורס יכלול כחמישה מפגשי מעבדות בנושאים: תגובות כימיות וסטוכיומטריה, קינטיקה כימית, חומצות ובסיסים, תאים חשמליים."
